positive	Ruukki 's order book at the end of 2010 was 30 % up year-on-year and 10 % up quarter-on-quarter .
positive	Ruukki signed the contract with Norwegian company Veidekke Entreprenor AS .
positive	Sales in Finland rose by 3.9 % and international growth was 0.7 % .
positive	Sales of security and system packaging increased slightly .
positive	Stora Enso 's third-quarter pre-tax profit doubled to EUR 197mn .
positive	Strongest growth was seen in the new markets in Russia , the Czech Republic , and Slovakia .
positive	The airline has ordered nine Airbus A350-900 aircraft with deliveries from 2011 , and in doing so becomes the lead airline for the latest variant of Rolls-Royce Trent series engines , called the 1700 .
positive	The company is now intensifying its smelter operations and increasing its annual production capacity to 230,000 tonnes of copper .
positive	The company 's market share is continued to increase further .
positive	The company 's scheduled traffic , measured in revenue passenger kilometres RPK , grew by just over 2 % and nearly 3 % more passengers were carried on scheduled flights than in February 2009 .
positive	The company said that its investments in the new market areas resulted in sales increase in Sweden , Poland , Russia and Lithuania .
positive	The disposal of Autotank will also strengthen Aspo 's capital structure , '' commented Gustav Nyberg , CEO of Aspo .
positive	The earnings per share for the quarter came in at 0.25 eur , up from the 0.20 eur of the same quarter a year earlier .
positive	The economic occupancy rate of Sponda 's property portfolio rose to 91.2 % from 88.8 % in 2006 .
positive	The Finnish supplier of BSS-OSS and VAS for telecom operators , Tecnotree , has received expansion orders worth a total US$ 7.3 mn for its convergent charging and next generation messaging solutions in Latin America , the company announced without specifying which operators had placed the orders .
positive	The group 's 12-month operating profit grew 31 percent to 337.8 million euros .
positive	The growth in the activeness of Talentum 's customers , which started at the end of 2009 , continued during the reporting period , the company stated .
positive	The growth of net sales in the first half of 2008 has been 28 % compared with the first half of 2007 .
positive	The pretax profit of the group 's life insurance business increased to EUR 36 million from EUR 27 million .
positive	The pretax profit of the group 's life insurance business increased to EUR36m from EUR27m .
positive	The total delivery volume of paper businesses in 2010 was 1,155,000 tonnes , up from 1,132,000 tonnes in 2009 .
positive	The value of the firm 's forestry holdings increased by SEK 3.6 bn .
positive	This new deal has strengthened the partnership from Telemig Celular and Tecnomen , which it has started since the beginning of Telemig 's prepaid operations .
positive	Turnover rose to EUR21m from EUR17m .
positive	Xerox and Stora Enso have teamed up to tailor the iGen3 to the short-run , on-demand packaging market .
positive	YIT Construction and the town of Riihim+Æki have signed a lease contract whereby the town will occupy the Travel Centre office facilities .
positive	The upgrade is intended to raise the network capacity from 450 MHz to 630 MHz in several cities , enabling bi-directional services for digital television as well as broadband data .
neutral	The Finnish company Stockmann has signed the contract with the company Technopolis .
neutral	According to its notice , Skandinaviska Enskilda Banken AB publ Helsinki Branch has on 10 August 2009 divested in total 11,958,000 Alma Media shares to Ilkka-Yhtyma Oyj and Kaleva Kustannus Oy , as the conditions of the agreement made by the companies on 1 July 2009 fulfilled .
neutral	As previously announced , GeoSentric Oyj entered into financing agreements with its lead investor on June 30 , 2010 enabling the Company to receive financing up to the aggregate amount of 6M .
neutral	At the same time , the market for automated liquid handling devices is already larger than that for pipettes , according to Biohit .
neutral	Efore 's CEO Reijo Maihaniemi said that the company has developed and already delivered power supply units to respective systems based on this technology to Chinese sector company ZTE Corp SHE : 000063 .
neutral	Finnish Talvivaara Mining Co HEL : TLV1V said Thursday it had picked BofA Merrill Lynch and JPMorgan NYSE : JPM as joint bookrunners of its planned issue of convertible notes worth up to EUR250m USD332m .
positive	Lead production , in turn , should increase to 60,000 tonnes through 2009 in what would be a twofold increase from current capacity levels , Zahariev said .
neutral	Lemminkainen Oyj said that it has signed credit agreements with Nordea Bank STO : NDA , Pohjola Bank HEL : POH1S , Sampo Bank HEL : SAMAS and Svenska Handelsbanken STO : SHB A .
neutral	Pohjola could increase its stake to 45 % in 2013 .
neutral	Scandic Feed will also diversify Tosno 's product portfolio further .
positive	Separately , YIT Corporation and Austrian firm E AG last week signed an agreement on the sale of E 's building system service business in Germany , Austria , Poland , the Czech Republic , Hungary and Romania for EUR 55 mln .
neutral	The agreement with JM is one in a series of contracts that TeliaSonera has signed in recent months with residential construction and real estate management companies in Sweden .
positive	The company intends to raise production capacity in 2006 .
neutral	The estimated value of the contract is EUR12 .4 m. Vaisala , headquartered in Helsinki in Finland , develops and manufactures electronic measurement systems for meteorology , environmental sciences , traffic and industry .
neutral	The mall is part of the Baltic Pearl development project in the city of St Petersburg , where Baltic Pearl CJSC , a subsidiary of Shanghai Foreign Joint Investment Company , is developing homes for 35,000 people .
neutral	The new facility , to be known as Technopolis Pulkovo , will introduce to the Russian market an entirely new concept of creating , operating and growing a commercially-funded science and technology park to support the growth of knowledge-intensive companies .
positive	Thereby , the company will expand its offering to North , Central and South America .
positive	To our members and partners , the use of IT will mostly be apparent in the increased efficiency of the results service , '' observes Perttu Puro from Tradeka .
neutral	Vacon controls a further 5 % of the company via investment fund Power Fund I. EUR 1.0 = USD 1.397
neutral	` This order is included in Wartsila 's order book in the second quarter , ' the company added .
neutral	`` Management decided at the end of 2005 to increase cathode copper capacity .
neutral	4 ) Complete name of the shareholder : Otto Henrik Bernhard Nyberg 5 ) Further information : The amount of shares now transferred corresponds to 5.68 % of the total number of shares in Aspo Plc. .
neutral	A data processing unit collects the data , calculates RVR values and provides the data to users via various interfaces .
negative	A tinyurl link takes users to a scamming site promising that users can earn thousands of dollars by becoming a Google ( NASDAQ : GOOG ) Cash advertiser .
neutral	ALEXANDRIA , Va. , March 28 -- Pertti Salmi and Hanna Vuolteenaho , both of Oulu , Finland , and Sami Viitasaari of Ii , Finland , have developed an ornamental design for a handset , the U.S. Patent & Trademark Office announced .
neutral	ALEXANDRIA , Va. , Oct. 3 -- Markka A. Oksanen and Harald Kaaja , both of Helsinki , Finland , Juha Salokannel of Kangasala , Finland , and Arto Palin of Viiala , Finland , have developed a system for providing communications security .
neutral	As earlier reported , Nokian Tyres is building a plant in the town of Vsevolozhsk in Russia 's Leningrad Region with an annual production capacity of 4 million tires .
neutral	Biohit , Inc. , has expanded its mLINE Family of Pipettors with the addition of the NEW 1-10 ml volume range .
neutral	Capman , the Finnish alternative asset manager , has made an acquisition for its Helsinki-focused vehicle , Real Estate Fund I. The fund has bought a seven-story office built in 1973 that underwent refurbishment at the end of the 1990s .
negative	Compared with the FTSE 100 index , which rose 36.7 points ( or 0.6 % ) on the day , this was a relative price change of -0.2 % .
neutral	Compared with the FTSE 100 index , which rose 51.5 points ( or 0.9 % ) on the day , this was a relative price change of -0.6 % .
negative	Compared with the FTSE 100 index , which rose 94.9 points ( or 1.6 % ) on the day , this was a relative price change of -0.4 % .
neutral	Deliveries are to start later in 2010 , and the volume will increase in the years 2011-2012 .
positive	Finland 's Nokian Tyres and Kazakhstan 's Ordabasy Corporation signed an agreement to build a plant in Astana to produce car tires , Ordabasy chairman Dinmukhamet Idrisov said at a press conference .
positive	Finnish business software group AffectoGenimap Oyj said it had signed an agreement to acquire all the shares in Swedish sector company Intellibis Ab for 12 mln euro ( $ 15.8 mln ) on a debt-free basis .
neutral	Finnish heat-retaining fireplaces maker Tulikivi Oyj said on August 29 , 2007 that its local tiled stoves and utility ceramics subsidiary Kermansavi Oy will merge into Tulikivi by means of absorption in order to streamline the latest 's corporate structure .
positive	Finnish silicon wafers manufacturer Okmetic Oyj said on June 29 , 2007 it signed an agreement with Nordea Bank Finland Plc , the local subsidiary of Swedish commercial bank Nordea Bank AB , which will refinance Okmetic 's syndicated bank facility which amounts to some 20 mln euro ( $ 26.9 mln ) .
positive	Furthermore , Bunge will also sign a licensing agreement for the Sunnuntai and Carlshamn Mejeri brands .
neutral	German Commerzbank AG 's Hamburg Branch and US JP Morgan ( NYSE : JPM ) participated as arrangers , and Dutch ING ( AMS : INGA ) as co-arranger .
neutral	In April 2005 , Neste separated from its parent company , Finnish energy company Fortum , and became listed on the Helsinki Stock Exchange .
neutral	In Russia , Raisio 's Food Division 's home market stretches all the way to Vladivostok .
positive	In September 2010 , the Finnish group agreed to buy Danish company Rose Poultry A-S for up to EUR23 .9 m in a combination of cash and stock .
neutral	Increase in the number of shares is based on the option rights which were granted to the management of the company under the stock option plan 2006 .
positive	is planning to expand its product portfolio in the harbor segment , chief executive Pekka Lundmark told Financial Times Deutschland .
neutral	It has some 30 offices worldwide and more than 90 pct of its net sales are generated outside Finland .
neutral	It has80 branches in Finland with annual revenue in Finland of ?
positive	KAUKO-TELKO LTD PRESS RELEASE 19.06.2007 AT 14.00 1 ( 1 ) Telko Group ( Kauko-Telko ) is expanding its strategic partnership with BP Industrial Lubricants & Services ( BP ILS ) by acquiring total ownership of BP 's Swedish retail company , Molub-Alloy AB .
neutral	MILAN ( AFX ) - The Italian shipping group Grimaldi has increased its stake in the Finnish company Finnlines to 35.4 pct from the 30.5 pct held in June , according to news agency ANSA .
neutral	Nokia Messaging 1.1 enables customers to receive e-mails from up to 10 e-mail accounts on their mobile phone supporting all POP or IMAP e-mail services .
positive	Production capacity will rise gradually from 170,000 tonnes to 215,000 tonnes .
positive	Ramirent s Danish subsidiary Ramirent A-S has today signed an agreement to acquire the business assets of the machinery rental company Jydsk Materiel Udlejning located in West Jutland .
neutral	SHARE REPURCHASE 11.01.2008 In the Helsinki Stock Exchange On behalf of Sampo plc Danske Bank A-S Helsinki Branch
neutral	Solidium picked up Tikkurila shares as a dividend at a book value of EUR15 .80 per share .
neutral	Takoma will carry out the transaction by acquiring the entire share capital of Moventas Parkano Oy , which runs the factory in Parkano , southern Finland .
positive	The agreement will provide The Switch with double the converter capacity , whilst opening up further manufacturing locations in China .
neutral	The building owner and developer , Sun Hung Kai Properties Group , is one of the largest property companies in Hong Kong , developing all types of premium residential and commercial projects for sale and investment .
neutral	The companies ' aim is to finalize the negotiations and sign the contracts at the start of October 2008 .
neutral	The companies signed the letter of intent for the sale on 17 September 2010 and envisaged to seal the actual agreement on 1 January 2011 .
positive	The company also said on November 16 , 2006 its Real Estate Fund I Ky signed an agreement with Finnish window maker Fenestra Oy to build a window plant in Forssa , southern Finland .
positive	The company has committed to further expanding the Apollo portfolio .
neutral	The contract , which was signed yesterday , will run for five years and includes a two-year extension option .
neutral	The contract covers installation , training and start-up services .
neutral	The contract value amounts to about EUR11m , the company added .
positive	The contracts have been signed to acquire uranium produced at the Sotkamo nickel-zinc mine in eastern Finland owned by Talvivaara .
neutral	The expanded agreement covers the sale , marketing and distribution of Benefon 's navigation and locator devices in China .
positive	The OMX Nordic 40 ( OMXN40 ) index , comprising the 40 most traded Nordic stocks on the Nasdaq OMX exchange , closed up 0.43 % at 1,138.84 points on Wednesday .
positive	The OMX Nordic 40 ( OMXN40 ) index , comprising the 40 most traded Nordic stocks on the Nasdaq OMX exchange , closed up 1.29 % at 1,084.47 points on Friday .
neutral	TietoEnator signed an agreement to acquire Indian research and development ( R&D ) services provider and turnkey software solutions developer Fortuna Technologies Pvt. Ltd. for 21 mln euro ( $ 30.3 mln ) in September 2007 .
neutral	To be number one means creating added value for stakeholders in everything we do .
positive	Under the terms of the off-take agreement with Talvivaara , Cameco will provide an up-front investment , to a maximum of $ 60 million , to cover the construction cost of the uranium extraction circuit .
positive	Vaisala Oyj Press Release September 30 , 2010 Vaisala has signed a contract to sell its oxygen measurement technology and business to SICK Maihak GmbH .
positive	- BEIJING XFN-ASIA - Hong Kong-listed Standard Chartered Bank said it has signed a China mobile phone dealer financing agreement with Nokia , making it the first foreign bank to offer financing to the country 's small and medium enterprise -LR
neutral	- Provides summary of the medical equipment pipeline products that the company is developing .
neutral	`` Of course , we are in talks with all those coming up with new projects that involve material handling , '' Konecranes President and CEO Pekka Lundmark said , when asked whether it was talking to Reliance Industries for supplying equipment to its upcoming refinery in Jamnagar .
positive	`` Lidskoe Pivo 's investment program foresees the integrated modernization of production , updating transport and logistics infrastructure and developing new marketing instruments , '' Mikshis said .
positive	`` Residentialconstruction in particular has picked up in several markets .
neutral	`` Ruukki is now included on DJSI World for the second year running and the European DJSI STOXX for the third year running .
neutral	`` The sale of the oxygen measurement business strengthens our goal to focus on our chosen market segments .
neutral	A corresponding increase of 85,432.50 euros in Ahlstrom 's share capital has been entered in the Trade Register today .
neutral	A In August 2007 , Latvijas Finieris ordered all production lines for a new green veneer mill to be built in Ukmerge , central Lithuania .
neutral	Finnish house manufacturers are targeting the strongly growing one-family house market in Russia .
positive	After the transaction , Alma Media raised its stake in Talentum to 30.65 % of the shares and some 31.12 % of voting rights .
neutral	Aldata said that there are still a number of operational aspects to be defined between it and Microsoft and further details of the product and market initiatives resulting from this agreement will be available at a later date .
neutral	ALEXANDRIA , Va. , July 11 -- Hannu Kahonen of Juuka , Finland , has developed an ornamental design for a handle for fire pit door , the U.S. Patent & Trademark Office announced .
neutral	ALEXANDRIA , Va. , May 16 -- Kenneth Bower of Vista , Calif. , has developed an ornamental design for a handset , the U.S. Patent & Trademark Office announced .
positive	As the largest elevator market in the world , Chinese output of elevators continued to rise to 262,000 units in 2009 , up about 5 % yr-on-yr .
neutral	Aspocomp intends to set up a plant to manufacture printed circuit boards with an investment of Rs310 crore .
neutral	Baltic Pearl CJSC , a subsidiary of Shanghai Foreign Joint Investment Company , is developing a project in St Petersburg , comprising about a million square meters of residential space , two hospitals and several schools and nurseries .
neutral	Biohit Oyj develops , manufactures and markets liquid handling products and diagnostic test systems for use in research , healthcare and industrial laboratories .
neutral	Calls to the switchboard and directory services have decreased significantly since our employees now have up-to-date contact information from all their colleagues and customers on their phone and can place the call directly .
neutral	Cargotec 's share capital after the increase totals 64,046,460 euros .
neutral	Cargotec 's share capital after the increase totals EUR 64,299,180 .
positive	Compared with the FTSE 100 index , which rose 28.3 points or 0.5 % on the day , this was a relative price change of 2.3 % .
positive	Componenta increased its stake in Turkish steel company Doktas Dokumculuk Ticaret ve Sanayi A.S. to 92.6 pct stake in March 2007 .
positive	Earnings per share EPS are seen at EUR 0.56 , up from EUR 0.38 .
positive	Estonia 's beer market overall grew three percent last year to 130 million liters .
neutral	Finnish food company Raisio Oyj HEL : RAIVV said on Friday it has wrapped up the divestment of its margarine operations to US sector player Bunge Ltd NYSE : BG for EUR80m USD119 .2 m .
positive	Finnish lifting equipment maker Konecranes HEL : KCR1V said on 29 July 2009 it has raised its stake in Austrian manipulator maker ACS Konecranes to 80 % and bought German sector player Knight Europe .
neutral	Finnish paper maker UPM-Kymmene Corp. on Monday announced the sale of its wrapping unit Walki Wisa to the CapMan investment group in a move to further concentrate on its core business .
neutral	Following the increase the company+ˆEUR TM s capital totals 5.5 mln Romanian lei $ 1.98 mln-1 .56 mln euro .
positive	HELSINKI AFX - KCI Konecranes said it has raised its stake in MMH Holdings Inc , the owner of US-based Morris Materials Handling , to 90.9 pct from 74.5 pct .
neutral	In 2008 , it generated net sales of EUR 9.3 million USD 13.1 m .
neutral	In August , Latvijas Finieris ordered all production lines for a new green veneer mill to be built in Ukmerge , Lithuania .
positive	It delivers a different user experience and enables us to widen the market we can address . ''
neutral	Jacobs has been supporting Storengy 's investment of developing storage sites since 2006 as owner 's engineer .
positive	ADPnews - Jun 30 , 2009 - Finnish stainless steel maker Outokumpu Oyj HEL : OUT1V said yesterday it signed a three-year EUR 900 million USD 1.3 bn revolving credit facility .
positive	Most of the increase in net sales was due to the acquisition of Swedish Silva that produces garden tools and boats .
neutral	Mr Ashley , deputy executive chairman of Sports Direct , sold a 43pc stake in the company for more than pounds 900m at the time of the float .
negative	One of the challenges in the oil production in the North Sea is scale formation that can plug pipelines and halt production .
neutral	Rental of building equipment accounted for 88 percent of the operating income .
neutral	Ruukki 's delivery includes steel structures , including installation , for Krakeroy bascule bridge and steel piles for the bridge foundations .
neutral	Sanoma will continue to focus on investing in digital media and on strengthening its market positions .
neutral	Stockmann was established in 1862 in Finland and it became the first foreign company to enter Russia 's retail trade market in 1989 .
positive	SysOpen Digia had signed an agreement with the main shareholders of Sentera holding in total 77.39 % of the share capital and votes of Sentera .
neutral	The acquisition is part of Suomen Helasto 's strategy to expand the LukkoExpert Security chain , Suomen Helasto CEO Kimmo Uusimaki said .
neutral	The broad-based WIG index ended Thursday 's session 0.1 pct up at 65,003.34 pts , while the blue-chip WIG20 was 1.13 down at 3,687.15 pts .
neutral	The business to be divested generates consolidated net sales of EUR 60 million annually and currently has some 640 employees .
neutral	The company generates net sales of about 600 mln euro $ 775.5 mln annually and employs 6,000 .
positive	The company plans to expand into the international market through its subsidiaries and distributors from 2011 onwards .
neutral	The company plans to spend the proceeds from the rights offering for strengthening its balance sheet .
neutral	The contract covers the manufacturing , surface-treatment and installation of the steel structures .
neutral	The corresponding increase in the share capital , EUR422 ,754 , has been entered in the Trade Register today .
neutral	The corresponding increase in the share capital , in total EUR 300,00 was registered in the Finnish Trade Register on May 8 , 2008 .
neutral	The corresponding increase in the share capital due to these subscriptions with the warrants , in total EUR 1,860.74 , was registered with the Finnish Trade Register on January 4 , 2008 .
neutral	The corresponding share capital increase , EUR 1,012,945.50 was entered in the Trade Register today .
positive	The decision to sell a share in Lenenergo was reached in line with Fortum 's strategic plans to invest mainly in generating assets in Russia , while Lenenergo is a grid company , the press release said .
positive	The equipment will expand container handling capacity at Namibia 's main port of Walvis Bay , on the west coast .
positive	The expansion includes the doubling of the floor space and the addition of more lifting capacity and production equipment .
positive	The Group aims to increase its net sales and comparable operating profit in 2006 .
neutral	The order also includes start-up and commissioning services .
neutral	The order consists of capacity expansion , maintenance services and new charging functionality , the company said .
neutral	The phones are targeted at first time users in growth markets .
neutral	The repayment of EUR 105 million debenture bonds is related to the Company 's previous announcement on October 21 , 2009 to collect irrevocable selling commitments from the holders of its subordinated debenture bonds .
neutral	The revenues of the business reached NOK 12 million for 2008 .
positive	The subscriptions increase Cargotec 's share capital by 36,780 euros .
positive	The subscriptions increase Cargotec 's share capital by EUR 27,060 .
positive	The total area of the Gorelovo plant is about 22,000 sq m. Atria invested about EURO 70mn in the plant , which should double Atria Russia 's production capacity in the St Petersburg area .
neutral	Tielinja generated net sales of 7.5 mln euro $ 9.6 mln in 2005 .
neutral	Tikkurila Powder Coatings has some 50 employees at its four paint plants , which generated revenues of EUR2 .4 m USD3 .3 m in 2010 .
neutral	U.S. District Judge Douglas P. Woodlock yesterday extended a Jan. 17 temporary restraining order until March 7 .
neutral	UK 's Sarantel to outsource part of its processes to Elcoteq plant in Estonia LONDON , Oct 13 , BNS - The British miniature antennas maker Sarantel has signed an agreement to outsource its assembly test and supply chain processes to the plant of Elcoteq in the Estonian capital Tallinn .
neutral	Under the rental agreement , Stockmann was committed to invest in the building of a bridge over the Gogol Street or build an underground tunnel for crossing the street by 2004 .
neutral	We have made long-term investments in developing the system 's implementation model .
positive	With the launch of new 3G handsets , Nokia aims to become the winner in China 's 3G market as it did in the 2G market .
neutral	With this subscription , Fortum 's ownership in TGK-10 has increased to slightly over 76 % of shares and voting rights .
neutral	VNH generates annual net sales of about 5 mln eur and employs 21 people .
positive	Earnings per share ( EPS ) for the first quarter 2007 amounted to EUR0 .07 , up from EUR0 .04 .
negative	Jan. 6 -- Ford is struggling in the face of slowing truck and SUV sales and a surfeit of up-to-date , gotta-have cars .
neutral	Rautakesko 's business operations in Norway and Russia , acquired in July 2005 , are included in the figures of the comparable period , impacting sales growth starting from August .
positive	Operating profit was EUR 11.07 mn , up from EUR 8.65 mn .
negative	Peer Peugeot fell 0.81 pct as its sales rose only 6.3 pct from the same period last year .
