negative	Pharmaceuticals group Orion Corp reported a fall in its third-quarter earnings that were hit by larger expenditures on R&D and marketing .
negative	However , the growth margin slowed down due to the financial crisis .
positive	Significance : Teleste has emphasised that with its large size and growing economy , as well as the rapid development of its TV services distribution industry , Poland is viewed as an attractive market .
positive	`` We reached agreement with the union that flights will continue as normal , '' Finnair spokesman Usko Maatta said .
positive	In Finland , insurance company Pohjola and the Finnish motorcyclist association have signed an agreement with the aim of improving motorcyclists ' traffic safety .
positive	HELSINKI ( AFX ) - Nokian Tyres reported a fourth quarter pretax profit of 61.5 mln eur , up from 48.6 mln on the back of strong sales .
positive	Kalnapilio-Tauro Grupe ( Kalnapilis-Tauras Group ) , which is owned by Denmark 's Royal Unibrew , raised its market share to 25.18 percent from 23.74 percent , as beer sales for the seven months jumped by 14.5 percent to 40.5 million liters .
positive	Kalnapilio-Tauro Grupe ( Kalnapilis-Tauras Group ) , which is owned by Denmark 's Royal Unibrew , raised its market share to 25.2 percent from 23.91 percent , as beer sales for the nine months jumped by 11.4 percent to 52.99 million liters .
positive	Marimekko has today ( 20 November ) signed a license agreement with the Swedish chain , whereby Marimekko will license some of its popular patterns from the 1950s , 1960s and 1970s to H&M .
positive	More staff has been recruited in Japan to further complement its network of close to 50 service locations in more than 20 countries worldwide .
positive	Nokian Capacitors ' equipment will be used to raise the capacity and reliability of the Indian grid .
positive	Rautaruukki Corporation Stock exchange release 3 December 2009 at 12 noon Ruukki 's construction and engineering divisions are to further improve and adjust their operations in Finland .
positive	Ruukki Romania , the local arm of Finnish metal producer Ruukki , increased its capital by 900,000 euro ( $ 1.14 mln ) through cash contribution , it was reported on September 19 , 2006 .
positive	STX Finland Oy signed a a preliminary agreement for the building of an environmentally friendly , new generation cruise ferry for Viking Line to manage on between Turku , Finland , and Stockholm , Sweden withViking Line ABP .
positive	The company now estimates its net sales in 2010 to increase considerably from 2009 and its operating result to be clearly positive .
positive	The tower it chose to add , due to go into operation in the summer , will increase total capacity to 80 broadsheet or 160 tabloid pages , with the ability to run 32 - and 48-page products side by side .
positive	Uponor made an operating profit of EUR 151.0 mn , up from EUR 143.7 mn , which made 2007 a record year .
positive	Basware Corporation stock exchange release August 31 , 2010 at 16:25 Basware signed a large deal with an international industrial group Basware will deliver Invoice Automation solution and Connectivity Services to an international industrial group .
positive	It estimates the operating profit to further improve from the third quarter .
positive	Kazgiprotsvetmet and Outotec Finland have signed an agreement on strategic cooperation in the marketing and providing of minerals processing and metallurgical plants and related services in Kazakhstan and the surrounding countries .
positive	Lemcon signed an investment cooperation agreement with the Kaluga regional administration last November .
positive	Ruukki forecast a 15-20 % annual sales growth and a positive pretax result for 2010 .
positive	Sales rose 10 pct to 566 mln eur on the back of strong volume and favourable currency effects .
positive	The growth of net sales has continued favourably in the Middle East and Africaand in Asia Pacific .
positive	The new agreement , which expands a long-established cooperation between the companies , involves the transfer of certain engineering and documentation functions from Larox to Etteplan .
positive	With this appointment Kaupthing Bank aims to further co-ordinate Capital Markets activities within the Group and to improve the overall service to clients .
neutral	Cencorp , headquartered in Virkkala , Finland , develops and supplies automation solutions to the electronics and semiconductor industry that enhance productivity .
neutral	Following the increase , Huhtamaki Oyj 's registered share capital is EUR 358,706,290.00 and the number of shares outstanding is 105,501,850 .
neutral	Following this increase Huhtamaki 's registered share capital is EUR360 .62 m and the number of shares outstanding is 106,063,320 .
neutral	The company has also supplied more than 200 MW of power generating equipment for a number of projects in Papua New Guinea , including 12 engines of the Wartsila 32 type to Lihir Gold .
neutral	Under the agreement , Pfizer has been funding Biotie 's research activities on the PDE10 phosphodiesterase 10 inhibitor program since its start in late 2006 and has the sole authority to develop discovered compounds .
neutral	When the OMX market forwards mature on May 16 , 2008 , Novator Finland Oy 's direct shareholding in Amer Sports Corporation will exceed one-fifth 1-5 of the company 's shares and voting rights .
positive	To prove the efficiency of the China Mobile system , Rod Baber , an English climber , climbed to the Mount Everest summit and successfully made calls .
neutral	`` These tests are part of a larger campaign which includes various customer trials and demonstrations to make LTE on 800 MHz commercially viable by this summer , '' Nokia Siemens head of LTE business line , Reino Tammela , said .
positive	Finnish Ahlstrom Corporation will double its investments in a new specialty glassfiber reinforcement plant in South Carolina , in the US .
neutral	Helsinki on October 22 , 2008 SSH COMMUNICATIONS SECURITY CORP Board of Directors For further information , please contact : Tomi Laamanen , Chairman , tel. +358 0 400 609 544 Distribution : NASDAQ OMX Helsinki Ltd. .
neutral	Patrizia adds the acquisition to a portfolio already worth EUR3bn .
positive	Sales rose to 300.9 mln eur compared with last year 's 276.1 mln eur and in line with 299 mln eur consensus figure .
positive	The contract was signed in August with Papua New Guinea-based Lihir Gold Ltd ASX : LGL .
neutral	The offer of some 30 million shares aimed to raise more than  x20ac 500 million US$ 640 million , was expected to be completed by Oct. 9 , Outokumpu said .
positive	`` Our extensive co-operation will also bolster SysOpen Digia 's position in the domestic operator market , '' Kallioranta adds .
positive	`` With this agreement , we can continue our good cooperationand at the same time release capital that has been tied up in ourmachinery operation .
positive	Theodosopoulos said Tellabs could be of value to Nokia Siemens or Nortel given its `` leading supply status '' with Verizon , along with high-growth products .
positive	We succeeded in increasing our market share of sold apartment '' , comments Mr Kari Kauniskangas , Head of YIT International Construction Services .
positive	With CapMan as a partner , we will be able to further develop our business and continue to focus on providing quality restaurant services for our customers , '' says Christopher Wynne , CEO of Papa John 's Russia .
positive	Finnish Suominen Corporation that specialises in wet wipes , nonwovens , and flexible packaging reports net sales of EUR 44.1 mn in the second quarter of 2010 , up from EUR 43.3 mn in the second quarter of 2009 .
positive	Finnish telecoms software developer Tecnomen Oyj said on December 5 , 2006 it won a $ 3.3 mln ( 2.5 mln euro ) order to supply an expansion of the charging and messaging systems for the mobile and fixed networks of Brasil Telecom .
positive	Increased trust of our clients in YIT can be seen as apartment sales accelerated .
positive	( ADP News ) - Dec 11 , 2008 - Finnish construction and engineering company Outotec Oyj ( OMX : OTE1V ) said today it won a EUR 28 million ( USD 36.8 m ) order to expand the phosphate concentrator in Siilinjarvi of Norwegian minera
positive	Mr Priit Kasak , Balti Metsamasina 's owner , said the Rakvere-based company wishes to increase Valmet 's market share from 27 % to a third in a couple of years .
neutral	Ponsse plans to create a network that is based on strong partnership , and participates in the production of larger entities than presently .
positive	The bank sees a potential for Getinge share to rise .
positive	The company recorded revenues of E658 .1 million during the fiscal year ended December 2007 , an increase of 23 % over 2006 .
positive	The cooperation will double The Switch 's converter capacity .
positive	The robust growth was the result of the inclusion of clothing chain Lindex in the Group in December 2007 .
positive	The six breweries recorded a 5.2 percent growth in domestic beer sales last year to 270.21 million liters , from 256.88 million liters sold in 2005 .
